{
  "schema": "subactor.physical-evidence/v1",
  "id": "dashboard-floor-plan",
  "coordinateSystem": {
    "unit": "m",
    "upAxis": "Z",
    "origin": "site-datum-A"
  },
  "records": [
    {
      "componentId": "facility_shell",
      "kind": "space",
      "evidence": "ifc",
      "position": [
        0,
        0,
        0
      ],
      "size": [
        58.2,
        34.6,
        0.2
      ],
      "sourceRef": "ifc:0xF17A"
    },
    {
      "componentId": "build",
      "kind": "space",
      "evidence": "cad",
      "position": [
        7.5,
        9,
        0
      ],
      "size": [
        12.4,
        14.2,
        3.2
      ],
      "sourceRef": "plan:A3-sheet2"
    },
    {
      "componentId": "test",
      "kind": "space",
      "evidence": "cad",
      "position": [
        22.5,
        9,
        0
      ],
      "size": [
        12.8,
        14.2,
        3.2
      ],
      "sourceRef": "plan:A3-sheet2"
    },
    {
      "componentId": "liquid_handler_01",
      "kind": "equipment",
      "evidence": "measured",
      "position": [
        4.6,
        10.1,
        0.9
      ],
      "size": [
        2.24,
        1.58,
        1.81
      ],
      "sourceRef": "register:LH-01"
    },
    {
      "componentId": "sequencing_01",
      "kind": "equipment",
      "evidence": "measured",
      "position": [
        19.6,
        10.2,
        0.9
      ],
      "size": [
        1.94,
        1.42,
        1.72
      ],
      "sourceRef": "register:SEQ-01"
    },
    {
      "componentId": "biospec_bioreactor_01",
      "kind": "equipment",
      "evidence": "ifc",
      "position": [
        21,
        -11.5,
        1.1
      ],
      "size": [
        2.86,
        2.86,
        2.24
      ],
      "sourceRef": "ifc:2N4mP"
    }
  ]
}
